{
	"slug": "north-las-vegas",
	"status": "drafted",
	"generation": {
		"generated_by": "write-content.py",
		"brief_version": "1.1.0",
		"brief_path": "content-engine/brief/production/north-las-vegas.json",
		"angle_id": "",
		"claim_ids_used": [
			"nlv-service-area-coverage",
			"biz-free-towing",
			"biz-same-day-pickup",
			"biz-no-hidden-fees",
			"biz-no-title-help",
			"biz-three-step-process",
			"biz-firm-offer",
			"biz-paid-at-pickup",
			"biz-condition-agnostic",
			"biz-hours"
		],
		"source_artifacts": {
			"angles": "content-engine/angles/north-las-vegas.json",
			"claims": "content-engine/claims/north-las-vegas.json",
			"place": "content-engine/place/north-las-vegas.json",
			"intent": "content-engine/intent/north-las-vegas.json",
			"entities": "content-engine/entities/north-las-vegas.json",
			"queries": "content-engine/queries/north-las-vegas.json",
			"retro_brief": "content-engine/brief/north-las-vegas.json",
			"differentiation_report": "content-engine/reports/differentiation/north-las-vegas.json",
			"corpus_summary": "content-engine/reports/corpus-summary.json"
		},
		"notes": "Service-area page (ADR-0009). No angle by design. Every factual sentence traces to a business-provided claim; no statutory or local-knowledge claim appears anywhere.",
		"generated_on": "2026-09-14"
	},
	"coverage": {
		"concepts_covered": [
			"confirming the service area covers the caller",
			"what the process actually involves",
			"which vehicle conditions are accepted",
			"what the offer does and does not include"
		],
		"concepts_not_covered": [],
		"questions_answered": [
			"Does the price change when the driver gets here?",
			"What do you need from me before you collect the vehicle?",
			"Can a pickup be arranged at the weekend?",
			"Do I have to phone, or can I start it online?"
		],
		"entities_explained": [
			"service area",
			"towing",
			"firm offer",
			"payment at pickup",
			"vehicle condition",
			"title",
			"scheduling",
			"hours"
		],
		"information_gain_delivered": [
			"Not applicable by design — a service-area page is judged on clarity and accuracy, not information gain (ADR-0009)."
		],
		"self_check": {
			"search_intent": "Transactional-local. The visitor wants to know the business covers their address and what happens next. The page answers both without detouring.",
			"semantic_coverage": "Coverage, condition, process, cost and scheduling - the chain a seller actually walks through, in that order.",
			"information_gain": "None claimed. This page is not trying to teach something its siblings do not; it is trying to convert a transactional query accurately.",
			"differentiation": "Structure is content/steps/services/content/cta, which no sibling uses - the others are all prose-only. FAQ questions were chosen specifically against the sibling set: 'how much', 'how fast' and 'is towing free' are already taken, so this page asks whether the price moves, what is needed beforehand, weekend availability and whether phoning is required.",
			"local_relevance": "Coverage is stated from the business's own configured service area. No local colour is invented - the areas are named, never characterised, because the source supports coverage and nothing more.",
			"naturalness": "No keyword repetition. 'North Las Vegas' appears where a person would say it and not otherwise.",
			"utility": "A reader learns whether they are covered, what the three steps are, what is included, and when collection is possible.",
			"claims": "Ten claims, all business-provided and sourced to business-config.php. Boundaries respected: same-day is 'available' not promised, no dollar figure is stated anywhere, and the missing-title answer offers help without asserting any legal rule.",
			"trust": "No invented experience, staff, history, reviews, customer stories or local knowledge. No statutory claim of any kind - the NRS material found during research is statewide and unsourced to primary text, so it is absent."
		}
	},
	"content": {
		"slug": "north-las-vegas",
		"city": "North Las Vegas",
		"state": "NV",
		"seo_title": "Junk Car Buyers in North Las Vegas | {business}",
		"seo_description": "We buy junk and non-running vehicles across North Las Vegas. Free towing, a firm offer, and payment at pickup. Call {phone} to get started.",
		"hero_heading": "Junk Car Buyers in North Las Vegas",
		"hero_description": "If the vehicle is sitting in North Las Vegas, we will come to it. Running or not, complete or stripped, the offer we quote is the offer you are paid.",
		"sections": [
			{
				"type": "content",
				"eyebrow": "Coverage",
				"heading": "Where We Collect From in North Las Vegas",
				"paragraphs": [
					"North Las Vegas is one of the areas we cover, and that includes Aliante, Eldorado and Sunrise Manor, along with the neighbourhoods off Craig Road and Las Vegas Boulevard North. If your street is not one of those, it does not mean we cannot reach you — the city is covered, and those are simply the parts people most often name when they call.",
					"It is worth saying plainly that towing is free on every pickup, and that nothing is deducted from the offer to pay for it. Distance within the service area is our problem to solve, not a reason to reduce what the vehicle is worth to you."
				]
			},
			{
				"type": "steps",
				"eyebrow": "How it works",
				"heading": "Three Steps From First Call to Getting Paid",
				"intro": "The process is the same whether the vehicle runs or has not moved in years.",
				"steps": [
					{
						"icon": "phone",
						"heading": "Call or request a quote online",
						"description": "Tell us the year, make, model and condition, and whereabouts in North Las Vegas it is sitting. Call {phone}, or start it online if you would rather not be on the phone."
					},
					{
						"icon": "cash",
						"heading": "Accept a firm offer",
						"description": "The figure we quote is firm. It is not an estimate that gets revisited later, and there are no fees taken off it afterwards."
					},
					{
						"icon": "truck",
						"heading": "We collect it and pay you then",
						"description": "We come to the vehicle, tow it at no cost, and pay you at pickup rather than at some point afterwards."
					}
				]
			},
			{
				"type": "services",
				"eyebrow": "What we buy",
				"heading": "The Vehicles We Take in North Las Vegas",
				"intro": "Condition is not a barrier. These are the categories most North Las Vegas pickups fall into.",
				"items": [
					{
						"slug": "non-running",
						"note": "Will not start, will not hold a charge, or has not turned over in years."
					},
					{
						"slug": "damaged",
						"note": "Collision or storm damage, whether or not it was ever repaired."
					},
					{
						"slug": "sedans",
						"note": "Ordinary cars that simply reached the end of being worth keeping."
					},
					{
						"slug": "trucks-suvs",
						"note": "Pickups and SUVs, including work vehicles taken out of service."
					}
				]
			},
			{
				"type": "content",
				"eyebrow": "What to expect",
				"heading": "What the Offer Includes, and What It Does Not",
				"paragraphs": [
					"The offer covers the vehicle as it stands. Towing is included, there are no hidden fees, and the amount agreed is the amount handed over at pickup. If you have been quoted elsewhere and found the number moved once the truck arrived, that is the part we are deliberately different about.",
					"Same-day pickup is available and often possible, though it depends on the day and how the schedule looks when you call. Our hours are Monday to Saturday, 7:00 AM to 7:00 PM, and Sunday from 9:00 AM to 4:00 PM. If the title is missing, say so on the call — it is a common situation and there is often a way forward, but it is worth raising early rather than on the doorstep."
				]
			},
			{
				"type": "cta",
				"heading": "Get an Offer for Your North Las Vegas Vehicle",
				"intro": "Two minutes on the phone is usually enough to tell you what it is worth and when we can collect."
			}
		],
		"faq_heading": "Questions People Ask Before Booking a Pickup",
		"faq": [
			{
				"question": "Does the price change when the driver gets here?",
				"answer": "No. The offer is firm once it is made, and there are no fees taken off it at collection. What you agree on the call is what you are paid."
			},
			{
				"question": "What do you need from me before you collect the vehicle?",
				"answer": "The year, make, model and condition, and where it is parked. If you do not have the title, tell us at that point — we can often still help, but it depends on the situation and it is better known early."
			},
			{
				"question": "Can a pickup be arranged at the weekend?",
				"answer": "Yes. We are open Monday to Saturday from 7:00 AM to 7:00 PM, and Sunday from 9:00 AM to 4:00 PM. Same-day collection is available, though whether it works on a given day depends on the schedule."
			},
			{
				"question": "Do I have to phone, or can I start it online?",
				"answer": "Either. You can call {phone}, or request a quote online if that suits you better. The process from there is the same."
			}
		],
		"final_cta": {
			"heading": "Ready When You Are",
			"intro": "Tell us what you have and where it is, and we will handle the rest of it."
		}
	},
	"_authoring_package": {
		"_instructions": [
			"Author canonical v2 content into this draft's `content` block.",
			"State as fact ONLY what appears in allowed_claims below. Nothing else.",
			"Derive the section plan from the angle and this page's purpose. Do not reuse a sibling's structure, and do not open a sibling page for reference.",
			"Write FAQs from this page's own questions. Questions listed under sibling_constraints.questions_already_answered are off limits.",
			"Business identity is tokenised: write {business} and {phone}, never literals.",
			"Do not invent statistics, reviews, testimonials, first-hand experience, staff, years in business, or local ownership.",